{
  "$schema": "https://json-schema.org/draft/2020-12/schema",
  "$id": "lab.multi_run_operating_contract.v1",
  "type": "object",
  "additionalProperties": false,
  "required": ["schema_version", "contract_id", "target_id", "target_class", "pack_status", "contract_status", "run_set_ref", "source_runs", "rules", "boundaries", "unknowns", "next_evidence_needed", "evidence_refs", "time_unix_ms"],
  "properties": {
    "schema_version": { "const": "lab.multi_run_operating_contract.v1" },
    "contract_id": { "type": "string", "minLength": 1 },
    "target_id": { "type": "string", "minLength": 1 },
    "target_class": { "type": "string", "minLength": 1 },
    "pack_status": { "$ref": "#/$defs/pack_status" },
    "contract_status": { "enum": ["measured_partial", "measured_reference", "insufficient"] },
    "run_set_ref": { "type": ["string", "null"] },
    "source_runs": { "type": "array", "minItems": 1, "items": { "$ref": "#/$defs/run_entry" } },
    "rules": { "type": "array", "minItems": 1, "items": { "$ref": "#/$defs/rule" } },
    "boundaries": { "type": "array", "items": { "$ref": "#/$defs/boundary" } },
    "unknowns": { "type": "array", "items": { "type": "string" } },
    "next_evidence_needed": { "type": "array", "items": { "type": "string" } },
    "evidence_refs": { "type": "array", "items": { "type": "string", "minLength": 1 } },
    "time_unix_ms": { "type": "integer", "minimum": 0 }
  },
  "$defs": {
    "pack_status": {
      "enum": [
        "observational_read_only",
        "read_only_plus_pressure_probes",
        "exploratory_pressure_smoke",
        "controlled_governor_subset",
        "controlled_operating_point_subset",
        "composite_coupling_probe",
        "platform_operating_contract_candidate",
        "platform_operating_contract_reference"
      ]
    },
    "status": {
      "enum": ["measured", "measured_partial", "not_controllable", "unsafe_to_run_with_reason", "not_applicable_with_reason", "insufficient"]
    },
    "run_entry": {
      "type": "object",
      "additionalProperties": false,
      "required": ["run_id", "run_dir", "role", "evidence_refs", "operations_summary"],
      "properties": {
        "run_id": { "type": "string", "minLength": 1 },
        "run_dir": { "type": "string", "minLength": 1 },
        "role": { "enum": ["primary", "included_evidence"] },
        "evidence_refs": { "type": "array", "items": { "type": "string", "minLength": 1 } },
        "operations_summary": { "type": "object", "additionalProperties": { "type": "string" } }
      }
    },
    "rule": {
      "type": "object",
      "additionalProperties": false,
      "required": ["rule_id", "category", "statement", "rule_source", "derivation", "evidence_refs", "confidence", "allowed_design", "blocked_design"],
      "properties": {
        "rule_id": { "type": "string", "minLength": 1 },
        "category": { "enum": ["allowed_default", "burst_only", "degraded_mode_trigger", "forbidden_pattern", "blocked_claim"] },
        "statement": { "type": "string", "minLength": 1 },
        "rule_source": { "enum": ["measured_target_evidence", "generic_lab_rule", "evidence_needed_rule"] },
        "derivation": { "type": "string", "minLength": 1 },
        "evidence_refs": { "type": "array", "items": { "type": "string" } },
        "confidence": { "enum": ["low", "medium", "high"] },
        "allowed_design": { "type": "array", "items": { "type": "string" } },
        "blocked_design": { "type": "array", "items": { "type": "string" } }
      }
    },
    "boundary": {
      "type": "object",
      "additionalProperties": false,
      "required": ["boundary_id", "statement", "status", "evidence_refs", "next_evidence_needed"],
      "properties": {
        "boundary_id": { "type": "string", "minLength": 1 },
        "statement": { "type": "string", "minLength": 1 },
        "status": { "$ref": "#/$defs/status" },
        "evidence_refs": { "type": "array", "items": { "type": "string" } },
        "next_evidence_needed": { "type": "array", "items": { "$ref": "#/$defs/evidence_gap" } }
      }
    },
    "evidence_gap": {
      "type": "object",
      "additionalProperties": false,
      "required": ["reason", "needed_probe", "blocking_missing_evidence", "next_action", "owner_surface"],
      "properties": {
        "reason": { "type": "string", "minLength": 1 },
        "needed_probe": { "type": "string", "minLength": 1 },
        "blocking_missing_evidence": { "type": "array", "items": { "type": "string" } },
        "next_action": { "type": "string", "minLength": 1 },
        "owner_surface": { "enum": ["adc-lab", "target", "external_tool", "operator_approval"] }
      }
    }
  }
}
